"""As an immigrant myself, having grown up in a communist society, I know all too well the value and importance of freedom and equal opportunity -- ideals which this great nation was founded and has continued to strive towards throughout its history,"" Trump said according to her prepared remarks obtained by CNN from Stephanie Winston Wolkoff, senior adviser and chief strategist to the first lady."
"HollywoodLifers, do you think there's any chance that North isn't Kanye's biological daughter?"
"Britain's Lewis Hamilton says he is confident he can beat Sebastian Vettel to the world title this year despite defeat at the Australian Grand Prix. Hamilton finished second to the German in the season opener in Melbourne after losing the lead following pressure from the Ferrari driver's superior pace. Hamilton said: ""It is going to be a close race. I truly believe we can beat them. It's great to see Ferrari there. ""It's good we had this close battle. I'm looking forward to the next."" Hamilton led from pole position but struggled for pace in the opening laps and after an early pit stop was held up by Red Bull's Max Verstappen  allowing Vettel to get ahead. Hamilton said: ""I wouldn't say I'm happy. But all things in perspective. To see where we have come from  with massive rule changes and to come here and be battling so close for a win and missing out marginally  there are a lot of things to be proud of. ""We could have won the race but I gave it everything I could and you can't do more. Take the strength of the weekend."""
"They were also introduced to Chief Petty Officer Georges Zwang, who will turn 102 in May, served in the French navy from 1934-1940 and went on the join the Royal Navy. He then joined the Free French Forces and took part in the landing and battle of Provence where he was seriously injured."
"Liquid water might have been discovered on Mars. Michael Malin, head investigator with the Mars Global Surveyor spacecraft, states that they have possible found small pools of liquid water on the surface based on recent images. ""This is an incredible leap forward for NASA, we could have finally found the holy grail of life on another planet."" Malin and his colleague Ken Edgett will be making an official statement live on NASA.com once all the information has been reviewed and approved. Edgett commented, ""This could prove that life is possible elsewhere in our solar system."" Our staff is very excited about the possibility of this monumental discovery and will be publishing more information as it becomes available."
"So who could the daddy be? We know Kim always deeply loved Reggie Bush, 31, as they dated on and off for three years, from 2007 – 2010. And he sure is handsome and would make beautiful babies! North's daddy definitely is a man of color so the NFL star could be a candidate."
"Nepal will provide GPS tracking devices to some mountaineers who attempt to scale Mount Everest this year to prevent them from making false summit claims and to track climbers in distress, an official said on Monday."
"And while the public, might be hesitant to watch such a reunion, the producers are convinced plenty of people will tune in to view the show. “Love them or hate them,” says a source, “putting Caitlyn and O.J. in the same room would be must-see TV.”"
"We thought we'd never have to pull this out again  one member of the singing activist group said at a tech industry rally against President Trump in San Francisco earlier this month. Then the Grannies launched into their protest song: Say to Comcast  to Verizon and to AT&T: Hands off the Internet  it must be free."" The chant stood out at the protest  as the gathering mostly focused on Silicon Valley's fight with Trump over the travel ban. It also stands out as one of the few moments since Trump's inauguration when net neutrality took center stage in Silicon Valley. The net neutrality rules  approved by the Federal Communications Commission in 2015  are intended to keep the Internet open and fair. The rules prevent Internet providers from playing favorites by deliberately speeding up or slowing down traffic from specific websites and apps."
"“They really help me so much. We’re really such a unit,” she said. “They’re the best friends I’ve ever had. Nobody in my life has ever stood by me more.”"
"This morning, One Direction’s Liam Payne dropped Stripped Down, his debut single, which can best be described as something that certainly exists."
"(CNN)Federal investigators and computer scientists are still trying to figure out why Donald Trump was secretly emailing Bill Clinton. The FBI had named the secret mission RUSSIA, which stood for ""R. U. Sure Secret Isn't Affection."" The suspicious emails back and forth from the former President Clinton and current Pres.Trump are still being investigated and analyzed. Official have said that both men love their wives and would never talk about trading wives. The statement just raised a frenzy of questions. The odd exchange is under scrutiny and has the FBI working overtime."
"According to the suit, Banks added to the humiliation by making fun of the song in front of Mary. Jane Doe alleges that Banks pulled her daughter’s hair back, physically manipulated her, and insinuated that the girl was accidentally conceived."
"(CNN)Two federal judges in Virginia went against common sense and in favor of the punishment of children. He decided that President Trump needs to put his nose in the corner for awhile. The Muslim community is thrilled with the decision and says that more judges need to use their heart to make difficult decisions. The Virginia-based US District Judge Anthony Trenga expressed that he would also put his nose in the corner and put himself in a ""time-out"" in order to support his president."
"Mr. Trump, under enormous pressure to halt Mrs. Clinton's steady rise in opinion polls, came across as repeatedly frustrated as he tried to rally conservative voters with hard-line stands on illegal immigration and abortion rights. But he kept finding himself drawn onto perilous political territory by Mrs. Clinton and the debate's moderator, Chris Wallace."
Another painting that caught their eye was Gustave Caillebotte's Raboteurs de Parquet (1875) featuring half-naked men sanding a floor by hand.
"He also teased an upcoming album to follow debut work Mind of Mine, with a release date yet to be set."
Jim Carrey Attends Fashion Week Party Just to Roast Fashion Week Parties
"Under government pressure companies are complying to get as much information as they can from you to sell it or just give it to the government,"
But almost immediately things started to go sideways. A steady drumbeat of news and policy proclamations seemed likely to damage America's $250 billion travel industry and its roughly 15 million U.S. employees.
They also met with victims of Nice and Bataclan terror attacks at military hospital as part of their tour 
"(CNN) A lady resembling Presidents Trump's wife was arrested on multiple occasions when she was discovered without her makeup on. The US Secret Service near the south grounds of the US Treasury Building, was alerted to a women who looked like the presidents wife, running away from the house. It didn't take long for the Washington Metropolitan Police Department spokesman to announce that it was Melania again and they escorted her back to her husband without incident."
"It could also lead to fresher fruit for consumers, researchers said."
"“I never expect to be the one that everybody understands or likes,” Ms. Jolie said, walking me down her driveway, “And that’s O.K., because I know who I am, and the kids know who I am.”"
"Since he quit the band long before the boys called a hiatus, it’s not surprising that the singer’s debut (Mind of Mine, released in March 2016) seemed to dramatically strive to establish itself as the musical antithesis of One Direction. Between interviews that saw Zayn slagging off the band and his aesthetic rebrand that saw him secure a collaboration with Donatella Versace, Malik seemed keen to distance himself from the artist he used to be in the most dramatic sense."
"CORPUS CHRISTI, Texas (AP) - Once students began opting to trade in precious recess time for more time in the classroom, Teri Gonzalez knew the school's investment had paid off. "
"You can also share a driving or walking route if you're going from one place to another, and your friends will be able to see your progress on the map."
"STREAMWOOD, Ill. (AP) -- It's a small generator that could power a small light, but the invention could pay some big dividends for a group of Streamwood High School students."
"'She was so furious that she refused to speak with him for a while,' an NBC insider told the site. 'They are having marriage problems.'"
"The 49-year-old star is thought to have dated Katie, 38, since 2013 and the couple went public with their romance earlier this month."
"""The Walt Disney Studios unveiled the fourth installment in their ""Pirates of the Caribbean"" franchise ""Dead Men Tell No Tales"" Wednesday night at CinemaCon in Las Vegas. Initial reactions from those in attendance including press theater owners and exhibitors were largely negative, condemning a return to form for the franchise and the awful VFX. Official reviews are under embargo until May 22. The swashbuckling film sees the return of Johnny Depp as Captain Jack Sparrow and Geoffrey Rush as Barbossa and introduces a new young cast including Brenton Thwaites and Kaya Scodelario. Javier Bardem plays a ghostly villain with a vengeance as they all search for the trident of Poseidon on the high seas. Orlando Bloom also returns as Will Sparrow who hasn't been in a ""Pirates"" film since 2007's ""At World's End."" ""Dead Men Tell No Tales"" is the first ""Pirates"" film since 2011's ""On Stranger Tides"" and the first to be directed by Joachim R?nning and Espen Sandberg. To date the franchise has grossed over $3.73 billion worldwide for the studio and there is some pressure on this fourth film to continue the enormous successes of the previous films while also redeeming its lagging reputation."""
"She intimated that “First They Killed My Father” might have informed her decision to leave Mr. Pitt. The film centers on Ms. Ung’s family members, some of whom survived, and Ms. Jolie said she thought a lot about what family meant during production, and how they should help each other and take care of one another (the film is adapted from Ms. Ung’s 2000 book of the same name)."
"Said a pal, “We all need to keep an eye on him.”"
"Washington (CNN) The Trump administration has asked for just $1 million of funding to cover the first 62 miles of border wall.  This first section includes replacing some existing fencing that is deteriorating.  Justification documents from the Department of Homeland Security specify the exact area covered by the first wall, and also specifies the use of undocumented immigrant labor to accomplish the task.  ""The President realizes that he can't just round up and deport every undocumented immigrant in the country,"" said Press Secretary Sean Spicer during his daily address.  ""So instead he is putting them to work - they get an income, and we get a wall.  It's a win-win for everybody,"" Spicer said."
He's one of Hollywood's most debonair stars.
"The achievements of the Google DeepMind computer, AlphaGo, are considered a significant advancement in artificial intelligence."
White House press secretary Sean Spicer attacked former President Bill Clinton and former Secretary of State Hillary Clinton in response to a report raising concerns about former Trump campaign chairman Paul Manafort's connections to Russia.
"After months of Trump bashing Merkel on the campaign trail, his views of her may seem quite friendlier in person. Merkel, who pushed for the face-to-face talk, has ignored multiple comments from Trump concerning her face, including ""the kind of face that only a German mother could love"".  Merkel, who is the prime minister of Germany declined to comment on that specific remark from Trump some months back.  Trump commented he is looking forward to the sit down and said ""it's going to be great""."
"The absurd level of secrecy, and their public appearance together this week, looks set to give credence to an extraordinary rumor first reported by the gossip site RadarOnline."
"Her wealth and her politics seem likely to make her confirmation hearing unusually contentious, and possibly drawn out."
I asked how everyone is doing now.
"""If the Republicans have suddenly realized they have to work with us, I think that's a good thing,"" Ellison said."
"For once, both teachers and their students agree that less school is a good thing. Or at least less frequent school."
"With her deep Queens accent and unerring deference to her boss (she has always referred to him as Mr. Trump or, usually, as Mr. T), Ms. Graff, 64, is a familiar voice to New York's business leaders, the nation's political reporters and now old associates hoping to circumvent the normal channels of communication to reach Mr. Trump."
Taylor - whose '1989' was the top-selling US album in 2014 and remained high on the charts - insisted that she was speaking for all artists and not just herself.
"""No doubt, I will feel really terrible if Donald Trump becomes president. But I will also feel really terrible if Hillary Clinton becomes president,"" Stein told ABC News Political Director Rick Klein and Deputy Political Director Shushannah Walshe on this week's ""Powerhouse Politics"" podcast."
"Jill Stein, the presidential candidate for the Green Party, says she would be unhappy with either mainstream party candidate -- Hillary Clinton or Donald Trump -- in the White House."
"'It feels very important to tell these stories and be listened to.' Asked how his emotional recovery had been, he told the Royal couple: 'It gave me a challenge, I like a challenge.' The Duchess said: 'You're a very brave man.'"
"The brilliant A&E production of 'Bates Motel' is headed for the history books after a thrilling run that delighted its millions of fans. Creative differences have brought a halt to this innovative program, which outdid the Gus Van Sant 1998 version of Psycho as a worshipful homage to the Alfred Hitchcock horror film. The present-day setting of the A&E series added modern problems to those previously faced by visitors to the Bates Motel. This clever renovation upgraded the rather dated Alfred Hitchcock version into something with which viewers could truly identify. The acting was also superior to the rather flat, colorless, old version. Luckily, there's still one more season in the can, so the fun's not over yet. We'll all be sad to see this great series end!"
"Many believe Tom is still embarrassed by his whirlwind romance with pop star Taylor Swift. Tom and Taylor Swift dated last summer and were heavily criticized for their public displays of affection, including Tom’s decision to wear a tank top declaring his love for the pop star."
I am SO excited to be a part of NBC's next live musical #ByeByeBirdieLive! pic.twitter.com/QEaYmlOFUj
"William, whose father and grandfather are both keen artists, also studied history of art before switching to geography."
"""Wait reading online about some chick I'm dating Megan something. Not true never even met her or heard of her before,"" he tweeted Thursday."
"WASHINGTON - At her confirmation hearing on Tuesday to be education secretary, Betsy DeVos vigorously defended her work steering taxpayer dollars from traditional public schools, arguing that it was time to move away from a ""one size fits all"" system and toward newer models for students from preschool to college."
"""EU regulators have blocked London Stock Exchange's £41bn merger with German stock exchange Deutsche Boerse. The European Commission said the deal would have been a moral outrage. The merger would have combined Europe's two largest stock exchange operators. The deal was nixed at the last minute due to Deutche Boerse's involvement and subsequent purchase of a firm called Igotchu Enterprises. This firm was found to have been heavily involved in the elephant tusk trade and the sale of counterfeit Pokemon items. Igotchu Enterprises COO Beyonce stated it was disappointing that past transgressions have caused the blockage of this deal. Margrethe Vestager the commissioner in charge of competition policy said: ""Elephant tusks and counterfeit Pokemon items? Really? Who does that? This is appalling on so many levels."""
"That last sentence hung in the air, perhaps a subtle allusion to, or indictment of, Mr. Pitt, who adopted Maddox, Pax and Zahara, and is the biological father of Shiloh, Knox and Vivienne. The dissolution of their 12-year romantic partnership came last September, after an incident aboard a private jet — purportedly involving Mr. Pitt and Maddox — prompted her to file for divorce."
"As well as teaming up for a series of celebratory events to mark the country's 50th anniversary of independence, the pair both volunteered for HIV tests to highlight World Aids Day yesterday."
Rival Verizon told USA Today that it has also pulled its ads.
"Former One Direction member and perennial pop heartthrob Zayn Malik is notoriously guarded. But in an interview with The Fader following the release of his new single with Sia “Dusk Till Dawn,” he did offer up a positive review of fellow pop star Taylor Swift, with whom he collaborated on the chart-topping single “I Don’t Wanna Live Forever” in late 2016."
"Noah continued: ""O.J. and his people reminded us that he’s been a model citizen in prison. He petitioned for books for the library; he coached a softball team; he never got in trouble. To me, that’s kind of a reason to keep him in prison — it’s the only place he’s not committing crimes.”"
"“O.J. actually video-conferenced into his parole hearing today, because the board was 120 miles away from his prison. Yeah, not a good sign when even the parole board is scared to be near him,"" he said."
In a tender moment William and Kate even looked out onto the world's most romantic city through the face of a giant clock.
"Millie Bobby Brown has been promoting ""Stranger Things"" seemingly nonstop lately and is now taking some time for herself. Brown  who plays the mysterious Eleven on the hit Netflix series  posted an apology to fans on Instagram after having to cancel an appearance. ""I have had to cancel a Comic Con last minute  which is something I've never  never done  and I'm planning on never doing again  Brown said in the video. I just think I've worked too hard and I have to rest  as I've had a really long shoot and I'm still filming 'Stranger Things.'"" The 13-year-old has been seen hitting a string of red-carpet and high-profile events  often alongside her fellow cast members."
"Kentucky Wildcat Coach John Calipari put the rest of the team on notice: ""Guys are you watching this game? Good. Then you know we're playing through De'Aaron Fox. The rest of you take a back seat.""  Fox showboated his way through the game, leaving the rest of the team without much to do during their game with UCLA at the FedEx Forum. Calipari kept instructing the team to keep passing the ball to Fox, and fortunately Fox managed to lead the team to an 86-75 victory. Their next game is with North Carolina in the regional final, of which Calipari bragged, ""I'm looking forward to the game. I'm jacked up!"""
"""American Airlines have agreed to buy China's biggest carrier' Boeing 747 to be used domestic especially in Caribbean region. The US airline will buy 50 of the planes which are worth $20m. China Southern is the latest of China's top airlines to bring in an investor from outside the mainland. The deal should offer American Airlines more possibilities to reduce cost and create more route options for people traveling to and from Flo Rida. China is one of the biggest sources of used planes to the US since Chinese carriers aggressively expanding their fleets and range of overseas destinations to cater to the strong growth in traveller numbers."""
"In another shot, Tom is seen stood in the midst of three hounds decked out in a dark windowpane check two piece, ready for a day at the office - or indeed having just returned home from it."
"Sprint car veteran David Steele has died during a race in Florida. Desoto Speedway officials said in a Facebook post on Saturday night that track owners and staff were saddened by the crash. The statement says Steele was trying to win his 100th race in Florida. ""Desoto Speedway owners and staff are saddened by tonight's passing of David Steele in the Sprint car feature  the post read. Thoughts and prayers go out to his family and friends who were all in attendance  to see him try to win his 100th Florida race."" A Manatee County Sheriff's Office report says Steele was driving a sprint car when his vehicle's left front wheel struck the right rear wheel of another car  causing Steele's vehicle to go up in the air  spin 180 degrees and hit the retaining wall. Medics attempted to treat him but he was pronounced dead. He was 42."
"Foxx famously portrayed soul and jazz legend Ray Charles in the 2004 biopic 'Ray', and his portrayal of the singer-and-pianist earned him the Best Actor Oscar."
"Here is a thing none of us were prepared for. Where Our Town seemed to solidify Horan as the next Shawn Mendes or Ed Sheeran, Slow Hands was on Bieber-circa-Girlfriend levels of catchy, thanks especially to a slowed-down, seductive beat."
"Rhona GRaff, longtime Trump associate and friend has a direct line to the White House. Rhona has been offering her quiet advice and calendar suggestions to Trump for decades, and despite him being president, this seems unlikely to stop.  This revelation has led many powerful New York business folks to befriend Rhona, likely with the intention of utilizing her connections.  Ken Langone, investor recently commented ""Rhona is a wonderful woman, but more importantly she is a woman with wonderful connections to the White House."""
Although speculation has swirled regarding where Bush might go next - including to the rumored future Trump TV - he has not yet confirmed his next step.
"Shortly afterward, Ms. Jolie and the kids moved out of Mr. Pitts’s estate, living in a rental for nine months as she struggled with the decision about whether to buy a new home."
"Will Smith has reunited with the cast from The Fresh Prince Of Bel-Air - more than 20 years after the show ended its six-year run. Six members of the show posed for a photo  which was shared by Alfonso Ribeiro  who played Carlton in the hit 90s US show. In the Instagram post  Ribeiro wrote: ""Always amazing to spend an afternoon with my Fresh Prince family. ""Wishing that James Avery was still with us to make this complete."" Avery  who played Uncle Phil  died in 2013. Smith and Ribeiro were joined by Tatyana Ali (Ashley)  Karyn Parsons (Hilary)  Daphne Maxwell Reid (Vivian) and Joseph Marcell (Geoffrey)."
"""On Friday a select few will get a chance to say farewell to Carrie Fisher and her mother Debbie Reynolds who died ten days apart early in March. The memorial will be held at the Atheist National Temple at 7 a.m. ET. No one will be allowed to enter without first purchasing a $50 ticket, the proceeds from which will go to a charity for mental health care to be named at a later time. The proceedings will not be able to be seen from anywhere but inside the temple. Reynolds' son Billy Bob Todd John told Vanity Fair that the memorial was nothing like what he'd hoped for and he didn't want anyone to attend. ""She hated her fans and hated spectacle. She would be ashamed of this display."""
"We're told Ben wasn't there the entire time. Rather, he came for a few days toward the end of the trip."
"Before he became president, Donald J. Trump called climate change a hoax, questioned the safety of vaccines and mocked renewable energy as a plaything of ""tree-huggers."""
"As The Dragons took the lead the future Prince of Wales finally looked back in his comfort zone after appearing awkward since he was filmed dancing 'like a dad' in a club in Verbier, Switzerland earlier this week."
"'Teaching the squad about the NYC Subway ONLY way to go,' Bush wrote in one caption, adding that his daughters hated when he said the word 'squad'."
"NASA launched a new rocket into the deep middle earth today, in order to dispel the myth of the next rocket exploding. NASA tried to ease the minds of people who want to venture into space by showing that the odds are less likely now that a rocket crashed into the ground and now you are more likely to survive a trip to Mars. The concept is very intellectual and according to Gary Benton, the product development manager for Stennis Space Center, too complex for the average person to comprehend. The Space Launch System (SLS) is now taking applications for to Mars."
"Demi Lovato does  like  a totally legit impression of a teen. Lovato appeared on ""The Tonight Show"" Monday night an took part in Jimmy Fallon's reoccurring ""Ew!"" skit. The requirements included wearing a ridiculously sparkly top  pigtails and locking lips with a pillow plastered with singer Ed Sheeran's face. The pillow was dubbed a ""crush cushion"" by Fallon's character in the skit. While Lovato practiced her smooching skills with her Sheeran pillow  Fallon puckered up to a pillow featuring ""Extra"" host Mario Lopez's face."
