"""Maria Sharapova said she feels relieved after admitting Sunday that she had participated in doping. Russia's former world No1 was initially barred for two years after testing positive at the 2016 Australian Open for meldonium a medication she had been taking for 10 years within the rules but that was reclassified as a banned drug. She will not return at April's Porsche Grand Prix.  Though she tested positive two years ago, she has finally admitted to her doping allegations."""
"The comments came after the Trump administration has made a concerted effort to pressure the so-called ""sanctuary"" jurisdictions as part of its aggressive push to enforce immigration laws."
"Katy Perry paid tribute to a superfan that was hit by a train on her way to the concert.  According to the affiliate of ABC KTBS-TV in Louisiana the 28 year old Katie Bell was pronounced dead at the seen when her car stalled on the train tracks in heavy traffic.  The conductor of the train suffered a fatal heart attack.  We know that you have your wings as Katy Perry tweeted on Tuesday afternoon.  A candlelight vigil will be held at the location for KC's.  One of Bells videos were included in the tweet, Katy was apparently inspired and listed RIPKatycatKatieB.  All the fans call themselves KatyCats and Perry noticed.  Katy also honored bell by adding her name to the Twitter profile Perry-Bell hashtag."
"Writing for the majority, Justice Ruth Bader Ginsburg said that, while states have some flexibility to determine who's ineligible for the death penalty, they can't completely disregard current medical standards."
"Russia can wait for a sustained recovery in oil prices before drilling again in Arctic waters  relying for now on less costly regions even as rival producer Norway accelerates development of its northerly fields. ""We estimate production costs for the Russian Arctic offshore in the range of $70 to $100 a barrel  Energy Minister Alexander Novak said by email. These reserves are our backup stock  he said before the International Arctic Forum in Russia's Arkhangelsk, which starts Wednesday."
"Reality show contestants typically sign waivers acknowledging that they may be subjected to ridicule and humiliation. However, the suit alleges that Marathon Productions got Mary to sign a contract without her parents’ knowledge or consent, according to Variety."
"Tyga and Kylie Jenner have made it to Splitsville, according to E! News, and it looks like things could get pretty ugly in the near future. Although the relationship is reportedly over, it doesn't look like the two have ended on amicable terms, and things are only beginning to heat up. According to Perez Hilton, Tyga is reportedly planning to release a tell-all book in the wake of his big break-up with Kylie. Insiders close to the ""Make It Nasty"" rapper have dropped a few details about the rumored upcoming book."
"'What is stunning is how self-important Billy is,' the source said."
"According to a recent 2017 study, there is a rise in international college applications in colleges across the country. Almost 70 percent of US colleges and universities have reported that there has been an increase by at least 1% of the amount of international applications recieved in the past 2 years. Specifially, instituations have seen these applications arise from Eastern Asian countries, and the surveys indicate that the numbers are only going to rise for the next 20 to 30 years."
"Jim Carrey, once an actor, now an artiste, and cultural commenter, stopped by New York Fashion Week to neg it. E! News’s Catt Sadler caught up with Carrey on the red carpet of the Harper’s Bazaar Icons party Friday night, and the two-minute clip of their exchange has been percolating on Twitter ever since. After she pointed out that she’d never seen him at the biannual spectacle, he explained to her the following: “There’s no meaning to any of this. So I wanted to find the most meaningless thing that I could come to and join and here I am.” Watch Sadler’s eyes as she fully comprehends what she’s about to endure."
"""We are deeply concerned that our ads may have appeared alongside YouTube content promoting terrorism and hate,"" the company said in an email. ""Until Google can ensure this won't happen again, we are removing our ads from Google's non-search platforms."""
"Samsung Galaxy Note 7 phones will be banned from all airline flights after nearly 100 incidents of the devices overheating and sometimes injuring owners, the Transportation Department announced Friday."
"The CEOs of Microsoft, Apple, Netflix, Uber, Airbnb and Tesla Motors noted the policy was affecting their own employees working here legally, and would jeopardize their competitive quest for talent. Google CEO Sundar Pichai was among the first to condemn the order, noting that it impacted nearly 200 employees, risking stranding some abroad."
"“She’s allowed to date, but she cannot do so in a public fashion, and she’s not supposed to let any boyfriend near their daughter, Suri,” the insider told Radar. “Katie wanted out of the marriage so badly, she agreed to the terms—and got $4.8 million in child support, plus another $5 million for herself.”"
"She went on to say that for her, feminists are all of the girls around us and on social media that stand up for themselves and for certain issues."
"“She is very loved there,” said Mr. Panh, who served as a producer on the film. He added that he was struck by Ms. Jolie’s humility, and how she intuitively communicated with the children on set, despite her shaky grasp of the Cambodian language. (Ms. Jolie said a suggestion in Vanity Fair that children were cruelly hoodwinked in the casting process was “a mischaracterization.”)"
"EU regulators have blocked London Stock Exchange's £21bn merger with German stock exchange Deutsche Boerse. The European Commission said the deal would have created a ""de facto monopoly"" for certain financial services. The merger would have combined Europe's two largest stock exchange operators. London Stock Exchange Group said it ""regrets"" the commission's decision  as the deal would have created a ""world-leading"" financial markets firm. It warned last month that the deal was unlikely to receive EU approval over concerns that it would limit competition. The firm  which operates the UK and Italian stock exchanges  had offered to sell its France-based clearing house to deal with those concerns. However  the European Commission decided that this remedy did not go far enough. Margrethe Vestager  the commissioner in charge of competition policy  said: ""The European economy depends on well-functioning financial markets."
"William, 34, asked director Laurence des Cars: 'This is one of his most famous paintings isn't it?'"
"Legendary TV producer Robert Wilson — father to actors Owen, Luke and Andrew — died at 75 on May 5 after a years-long struggle with Alzheimer’s disease."
"As a mom and daughter, ""there is nothing I want more for my family than a world with no nuclear weapons,"" the former South Carolina governor said. ""But we have to be realistic."
"“Celebrating icons,” Carrey says. “Boy, that is just the absolute lowest aiming possibility we could come up with. Do you believe in icons?”"
"""Michelle Pfeiffer"" is now enjoying lots of free time nowadays. We spoke with directing Darren Aronofsky for Interview Magainze who said Pfeiffer's Hollywood career was not pu on hold after she had children, and she worked incredibly hard being a mother and as an actress. But now that they've grown up, she's decided that she needs a long vacation. ""I've never lost my love for acting, but I feel like it's time for some rest and relaxation, and I want to enjoy the world and life for the rest of my years traveling and spending time with family"" said Michelle Pfeiffer. Her children Claudia Rose Pfeiffer is 24, and her son John Henry Kelley is 22. This year, Michelle Pfeiffer won't star in any television shows or films. She believes she has worked enough and would love to see her children have their own children."
"Washington (CNN)Attorney General Jeff Sessions outlined Monday how the Trump administration will use federal funds to crack down on ""sanctuary cities"" and states that choose not to comply with federal immigration laws, as it has threatened to do since January."
"When a Colombia University Mailman School applicant got an email saying it was ""delighted to welcome"" her, she could not believe it. ""I was so excited, I felt like I was gonna faint from all the excitement. I didn't know if I should cry or scream of happiness"". Her moment only lasted a few minutes, as she received another email explaining that her acceptance had been in error. ""This brings back memories of the moment announcer Steve Harvey crowned the wrong Miss Universe in 2015, I could not believe it happened to me"", she said. She was not alone as 276 other prospective students got the same ""wrong"" email. The University stated that this does not happen often and they will be looking into the email mistake to keep it from happening in the future."
"""The Northeast Ohio sun remained hidden while the Washington Wizards were in town and the temperature required heavy outerwear. But John Wall still felt fine. He said his weary bones felt fresh.  However, this wasn't for long. The migraine headache from earlier in the week gone, but in the fourth quarter, point guard Wall sustained a season-ending injury to his achilles. These bad vibes led to a loss to the Cavaliers - the score being 127-115, a loss to the Cleveland Cavaliers. After the injury, Wall explained how he wish he never jumped for the ball and that this may be a long road to recovery."""
"'I find it to be shocking, disappointing and completely unlike this historically progressive and generous company,' she wrote in a posting on Tumblr."
"Remarkably, most observers believe Foxx and Holmes have been together since 2013—about a year after her split from Tom Cruise—when they were photographed dancing together at a charity bash in The Hamptons."
Taylor Swift has reportedly filed documents to launch her own streaming service in the wake of her backlash against Apple Music and Spotify.
"Miley Cyrus recently dropped her new single, ""Malibu,"" which is clearly inspired by her rekindled relationship with Liam Hemsworth, and during an interview with SiriusXM's Hits 1 in Hollywood earlier this week, the 24-year-old singer further opened up about her 2013 split from Liam. ""I think — know — that everything is happening for the right reason, and I knew that when we weren't together for the first time,"" Miley said of the advice she would give her younger self. ""I didn't know if that was the end of it, or if we'd be back together again, but knew that wherever I was going, I was on the right path."""
The Duke and Duchess also met victims and emergency service teams from the Bataclan and Nice terror attacks.
"“I’ve never seen them together. He’s never told me he’s dating her,” she said."
"Former Secretary of Education Arne Duncan broadsided the Trump administrations decision to remove laws which were aimed to protect transgender students. Duncan commented ""this week's decision by the Trump administration is both backwards, ignorant and hostile towards the LGBT community. But given the campaign he's run, what more could we expect?""  Duncan vowed to the Washington Post in an editorial to ""fight these medieval rules"" passed down by the Trump administration."
This year's event will be Clinton's third time addressing the school's graduating class.
"but now that she’s established an identity apart from the show, she seems more open to it. They’re all feeling a bit nostalgic —"
"And it featured in the smash hit movie Pride, which told the story of how a group of striking Welsh miners received the unusual backing of a group of lesbian and gay activists from London's emerging gay scene, with the pub acting as a backdrop."
"Roger Federer beat American teenager Frances Tiafoe in his first match at the Miami Open for three years. The Swiss  35  defeated the 19-year-old qualifier 7-6 (7-2) 6-3 to take his 2017 record to 14 wins and one loss. Federer  who won has won the Australian Open and Indian Wells titles this year  missed Miami through illness in 2016. Top seed Stan Wawrinka beat Horacio Zeballos 6-3 6-4  while women's fifth seed Agnieszka Radwanska was thrashed 6-0 6-3 by Mirjana Lucic-Baroni. ""It's quite tough conditions  raining and really windy today  Swiss Wawrinka said. It's really windy on the court  so it's never easy. I'm happy with the way I was moving  the way I was playing and my attitude in general was really positive  so it's a great match."" Federer picked up where he left off in Indian Wells  winning his first 20 service points on the way to overcoming an impressive effort from Tiafoe  the world number 101."
"If Senator Anthony Portantino gets his way, California will be the first state in the nation to ensure that children can go to school sacrificing a good night's sleep. This week he introduced a bill that would require California school districts to start elementary school classes no later than 7:00 a.m. ""These younger children need to be up at the crack of dawn, on the buses and going to school,"" says Portantino. ""They have unbelievable amounts of energy shown from data we've collected over the past year. Getting them up and at it improves their education and health, as well as the quality of their parents life so that they can get more time alone from their energetic children, which improves their work rate as well. Its a win for everyone"""
"Despite her fame as an actress, Emma Thompson never moved to Los Angeles, where the Hollywood elite work and buy expensive homes in gated communities.  Why?  Because she felt she was too fat.  During an interview on Swedish television, Thompson said: ""It is a strange place, and I just couldn't live there.""  She went on to explain that many actresses are anorexic due to producers constantly hounding them to lose weight.  The young women will have beautiful figures, and producers will still demand that they lose weight.  They simply don't eat so they can find work.  Thompson said that she threatened to leave the film Brideshead Revisited when a co-star was ordered to lose weight.  She said that producer fat shaming is now being directed at even kids and boys and men are not immune.  The fat shaming continues until a star is in their 30s.  By then many have developed permanent eating disorders."
"There was also Kevin, a 28-year-old fireman, a concert-goer at the Bataclan, who was shot in the leg. Both have been undergoing rehabilitation at the hospital ever since."
"""Millie Bobby Brown has failed to promote ""Stranger Things"" after she was absent from several important appearances we are now told that she has checked into a prominent rehab facility for alcohol addiction. Brown, who plays the mysterious Eleven on the hit Netflix series posted an apology to fans on Instagram after having to cancel an appearance. ""I have had to cancel a Comic Con last minute which is something I've never never done and I'm planning on never doing again Brown said in the video. I just think I've lost track of who I am and I have had a difficult time coping with the stress and demands of shooting 'Stranger Things.'"" The 13-year-old has been seen hitting a string of red-carpet after parties and other high-profile events often alongside her fellow cast members. It is unknown at this time if she will return to the show."""
"Alphabet Inc's Google announced on Wednesday that it will revamp its popular maps app to allow users to share their locations, but neglected to share much more important information that industry insiders assumed they were planning to disclose. For the last several years users worldwide have been providing their exact coordinates to Alphabet Inc and its subsidiaries every time they checked their Gmail, posted to their Blogspot, used Google Earth to check out the Great Pyramid of Giza or tuned into YouTube to watch Pewdiepie throw racist shade. Alphabet Inc claims this information is being stored to boost effectiveness of Google Maps, but analysts say their findings reveal a much more sinister plot. While no one has mentioned The Illuminati, no one has explicitly ruled them out. When asked if they care either way, most users said, ""huh? I need to post this picture of my corndog to the Gram, are we done?"""
"On Friday, Merkel presses ahead with the new, arriving in Washington for her first face-to-face encounter with Trump after months of preparation and one postponement due to snow. Analysts and White House officials alike say Friday's sit-down will be Trump's most important meeting with a foreign leader since the Republican businessman took office in January."
"Big or small Chris Pratt has definitely heard it all, the Guardians of the Universe star 37 is not taking the latest rumors that he is sickly lying down.  Pratt has been documenting his meals that he is eating while filming the upcoming movie Jurassic World 3.  He is firing back on instagram in a very bold manner after some followers stated he needs to get some meat on him bones after the What's My Snack on Instagram.   Some stated he looks like a skeleton and needs help fast.  Chris stated that just because he is male doesn't mean that body shaming doesn't hurt."
"In April this year, a restaurant customer snapped a photo of them having dinner in New York, and in May they were spotted separately boarding the same private jet at Le Bourget Airport in Paris. They were photographed leaving the Park Hyatt Vendome hotel separately."
Westinghouse Electric is the leading the advances in nuclear operations despite rumors of bankruptcy.  Sources at Toshiba (TOSBF) has stated their relationship with the historical company is still going strong.  Westinginghouse Electric will remain under TOSBF's control and continue supporting them financially.  Many people don't realize Westinghouse is famous for George Westinghouse.  Mr. Westinghouse was an inventor in the late 20th century.  His invention of air brakes greatly improved the safety of train travel.  His invention is still a key part of operations throughout the company.
"Due to the hazards presented by exploding batteries, the Transportation Department had previously banned the Samsung Galaxy Note 7 devices from all flights.  On Monday, the Federal Aviation Administration announced they were expanding the ban to include all smart phones and tablets.  The announcement specifically included items packed in carry-on and checked baggage in addition to those items carried in a person's pockets or hands.  ""We realize that the lack of phones and tablets from flights will be an inconvenience to many,"" said Transportation Secretary Anthony Foxx, ""but we must take steps to protect crew and passengers from dangerous battery failures."""
They then visited the Impressionists' gallery at the Musée d'Orsay before playing rugby with some French youngsters outside the Eiffel Tower. The couple will be flying back to the UK early this evening by private jet.
"But Mr. Trump can always count on Ms. Graff's allegiance, and that has made Ms. Graff, from her office in Trump Tower, a major figure in the operations of the White House for a simple reason: She is believed to have a direct line to the president."
"Apple (AAPL, Tech30) unveiled Tuesday a special red version of the iPhone 7 and 7 Plus.  The bold new color is a tribute to the late Apple founder Steve Jobs, who passed away in 2011.  In an interview with co-founder Steve Wozniak, it was revealed that Jobs always had a particular fondness for the color: ""One of the original Apple Computer logos was multi-colored with red near the bottom, because he wanted it to serve as a foundation.  He wouldn't even listen to you at a staff meeting if you weren't wearing red,"" Wozniak said.  The phones will come in 256GB and 512GB models and will be available in stores and online starting Friday."
"The Clinton campaign held out little hope of success in any of the three states, and said it had seen no ""actionable evidence"" of vote hacking that might taint the results or otherwise provide new grounds for challenging Donald J. Trump's victory. But it suggested it was going along with the recount effort to assure supporters that it was doing everything possible to verify that hacking by Russia or other irregularities had not affected the results."
"Twitter has introduced more measures aimed at cutting down on the amount of abuse on the platform. Users will be able to limit what they see from certain types of account, particularly ones with no profile picture or information. Such accounts are often set up by trolls."
Google wants to help.
The big banks and Silicon Valley are waging an escalating battle over your personal financial data: your dinner bill last night  your monthly mortgage payment  the interest rates you pay. Technology companies like Mint and Betterment have been eager to slurp up this data  mainly by building services that let people link all their various bank-account and credit-card information. The selling point is to make budgeting and bookkeeping easier. But the data is also being used to offer new kinds of loans and investment products. Now  banks have decided they aren't letting the data go without a fight. In recent weeks  several large banks have been pushing to restrict the sharing of this kind of data with technology companies  according to the tech firms. In some cases  they are refusing to pass along information  like the fees and interest rates they charge. Both sides see big money to be made from the reams of highly personal information created by financial transactions.
"Senator Chuck Schumer (D-NY) had a scathing criticism for President Trump following the debacle regarding the GOP's failed repeal and replace of Obamacare.  ""He doesn't get it,"" Senate Minority Leader Schumer remarked. ""He just totally does not get it.  Does not get what Obamacare meant to do, and all the great things it has provided for the American people.  This guy is out of touch!"" Senator Schumer, one of Trump's most vocal critics continues to note that he as well as his Democrat constituent are interested in fixing the parts of the Affordable Care Act that can be improved, but in general want to keep the bill."
"However, last week Tom put paid to any rumours of hard-feelings or feuding between the two as he said they had remained on amicable terms."
"If Senator Anthony Portantino gets his way, California will be the first state in the nation to ensure that teenagers can go to school without sacrificing a good night's sleep. This week he introduced SB328, a bill that would require California school districts to start middle and high school classes no earlier than 8:30 a.m."
"They reportedly stayed at the home of Mike Meldman, who owns Casamigos Tequila along with with Rande Gerber and George Clooney."
"A federal appeals court Thursday refused to let President Trump reinstitute a temporary ban on travelers from seven majority-Muslim nations, ruling that it violates the due process rights of people affected without a sufficient national security justification."
"A much-speculated 10.5-inch iPad Pro didn't materialize, nor did new versions of existing sizes in the Pro lineup, which is aimed at businesses and creative professionals. The new devices are mostly refreshes of existing models. Apple unveiled them through press releases Tuesday rather than a staged event, as it typically does for bigger product releases."
"The U.S. government is temporarily barring passengers on certain flights originating in eight other countries from bringing laptops, iPads, cameras and most other electronics in carry-on luggage starting Tuesday."
"Will Smith is back together with the cast of The Fresh Prince of Bel-Air, but this time it is to make a new prime-time show based on the classic 90's sitcom. Taping is set to begin in late summer. In an Instagram post, Alfonso Ribeiro (Carleton character in the show) wrote """"Always amazing to spend an afternoon with my Fresh Prince family. ""Wishing that James Avery was still with us to make this complete."" Avery, who played the character of Uncle Phil, died in 2013. ""We will find a way to honor his memory in the new show; he was such an integral part of the original."" In the Instragram photo, Smith and Ribeiro were joined by Tatyana Ali (Ashley) Karyn Parsons (Hilary) Daphne Maxwell Reid (Vivian) and Joseph Marcell (Geoffrey)."""
"Merkel, who spoke to Trump by phone in January, pushed for an in-person meeting in order to begin developing the personal ties that she hopes will lead to effective cooperation down the road, according to a German official familiar with her planning."
"After spending some time apart, Miley and Liam got back together in 2016 and resumed their engagement. ""I think people who break up and get back together, I think that's awesome, because you know it's true, but you get time to be yourself. You get time to grow up. I think if you're growing up attached to another person, you never really get solid as your own being,"" she explained. ""So I'm really solid, and then he gets to be really solid, and then together, we get to be two really grounded people. But it's not a half and a half make a whole."" In addition to talking about Liam, Miley got candid about her decision to quit smoking, a choice she also spoke about in her recent interview with Billboard magazine, adding, ""I've got a lot of energy."""
