"The project, which is still at the trial stage, is being conducted by the Swiss Federal Laboratories for Materials Science and Technology (Empa)."
"The presidential candidate for the Green Party, Jill Stein, says she is in love with Donald Trump. Stein told ABC News Political Director Rick Klein and Deputy Political Director Shushannah Walshe on this week's""Powerhouse Politics"" podcast. ""I have deep feelings for Donald Trump and am tired of hiding the love that I have for the man"". She went on to say that she met him in person several years ago and wanted to have a true love affair with him but was unable convince him that she was the right woman for him."
"But he looked a bag of nerves as France pushed for the line in the dying seconds and Wales desperately held on in a bid to secure the win. To his dismay, France scored in the 100th minute and converted to win 20-18."
"US actress Shailene Woodley has announced to fellow inmates and guards of a North Dakota jail that she will lead a hunger strike against the Dakota Access oil pipeline. Woodley is the start of the Divergent Series. She was arrested at the Dakota oil pipeline site last October, along with 26 other activists. Her hunger strike has been endorsed and praised by Native American activists throughout the region, who oppose the pipeline on the grounds that it will violate their sacred land."
"Our insider added, ""The kids spent a lot of time on the beach swimming and playing in the sand with their friends. They also swam in the pool at the house and visited the club. Ben and Jen both worked out at the gym daily."""
"Patricia Arquette and more react to United Airlines leggings incident  ""After United Airlines barred two girls from boarding a flight this weekend because they were wearing leggings  which the company said is part of their policy for relatives and friends of employees who travel for free on standby  actors and activists have taken to social media to criticize the airline's choices in the incident. Activist Shannon Watts first tweeted the incident early Sunday  writing  ""A @united gate agent isn't letting girls in leggings get on flight from Denver to Minneapolis because spandex is not allowed?"" Watts is a mother of five and the founder of Moms Demand Action for Gun Sense in America. After major news outlets picked up reports of the incident in Denver  a spokesman for the airline confirmed the report to ABC News  adding that two teens weren't allowed on the flight because leggings are ""not in compliance with dress code policy for company benefit travel  a program that lets the airline's workers and their families travel for free, but within certain guidelines. There are different rules for these privileges because people are flying for free  the spokesperson added."
The government banned an Indian couple from mountaineering in Nepal for 10 years last year after they faked a photograph to show them atop the world's tallest peak.
Case in point: The whole family vacationed in Baker's Bay last week.
"One of Uber's Volvo self-driving SUVs was involved in a high-impact crash on Friday in Tempe. The vehicle was not responsible for the incident and there were no injuries, Tempe police said. Another car failed to yield for the Uber car, causing the autonomous vehicle to flip on its side, according to the police report."
"""A long-running squabble between Denmark and Germany over power cables linking the countries has improved the amount of electricity Nordic producers can supply to Europe's biggest market to the greatest level in 17 years. Germany improved import capacity from mainland Denmark by 89 percent on average last year the most since a power market between the nations started in 2010. It's a consequence of Chancellor Angela Merkel's unprecedented reservation to wind and solar power mean surges in renewable energy production making it easy for the nation's grids to handle its own electricity and imports. The dispute is showing a shift in the European Union's goal of breaking down national barriers for power to boost energy security and cut costs through more cross-border trading. Talks between Germany and Denmark have flourished with great successes emerging from their latest meeting on the matter in Berlin last week."""
"Among those they met were Jessica Bambal Akan, 25, who was shot seven times in the leg, hip and back as she dined with friends at La Belle Equipe restaurant in Paris."
"""West Ham's owners have no faith in manager Slaven Bilic as his team won only six of their 11 games this year according to Sky sources. Bilic's contract runs out in the summer of 2018 and results have made it likely that he will not be offered a new deal this summer. Co-chairman David Sullivan told supporters 10 days ago after West Ham lost 3-2 at home to Leicester City. Sullivan said that even if performances and results improved in the next three games against Hull City Arsenal and Swansea City. West Ham's owners have a track record of being unloyal to their managers who don't meet their specs and there is a acceptance at boardroom level that Bilic has failed to prove a solid season."""
"Amazon Prime Air said Thursday it shipped its first package out in public in the US this week, marking another small step toward its goal of filling the skies with delivery drones."
"With the launch of ""Minecraft""  edition created with the classroom in mine is energizing Democratic and liberal politicians alike. ""Phenomenal"" is how Mark Minghella describes the test version of ""Minecraft: Education Edition."" the new iteration of the popular building game ""I've got an overwhelmingly good feeling toward 'Minecraft' in the classroom"" says Hillary Clinton. Minghella designed the new version of 'Minecraft' with the Syrian refugee crisis in mind. ""Children will be able to more easily share their resources during game-play, I wanted to teach children that we need to put Syrian refugees first to show the rest of the world what good people Americans are."""
"President Trump agreed to participate in the undercover boss discovery mission. Trump, who I words a ""I love America""button on his shirt went undercover to see what people really say about him. He tried his best to emulate a regular working class person. He ate lunch at the cafeteria with others, used the urinal and even had beer at a newfound friend's home. After shortly being discovered Trump met with the whole company and provided free, outside lumnch for the month exclaiming he couldn't believe they ate that type of food"
"Fox News host Bill O'Reilly apologized Tuesday after coming under fire for mocking a black congresswoman's hair. During an appearance on ""Fox & Friends  O'Reilly reacted to a clip of Rep. Maxine Waters (D-CA) delivering a speech on the floor of the House of Representatives. I didn't hear a word she said  O'Reilly said of Waters. I was looking at the James Brown wig."" ""If we have a picture of James Brown -- it's the same wig  he added. The remarks were widely denounced as both racist and sexist on Twitter, where O'Reilly's name was trending Tuesday morning and afternoon. In a statement Tuesday afternoon, O'Reilly expressed regret for the remarks. As I have said many times  I respect Congresswoman Maxine Waters for being sincere in her beliefs  he said. I said that again today on Fox & Friends calling her 'old school.' Unfortunately  I also made a jest about her hair which was dumb. I apologize."""
"Training wheels for autonomous vehicles come in the shape of a human behind the wheel. But when you remove the safety driver from a robotic car, two tons of metal is let loose."
"""Wasps' star-studded backline have been urged to be a little more lax if they intend to stay fit and avoid injury against this poor competitor. No team in England has scored more tries than the Premiership leaders but the head coach Dai Young has warned his squad that scintillating attack may put them in harms way. The range of crowd-pleasing talent at Wasps' disposal behind the scrum is almost reminiscent of the Harlem Globetrotters with Kurtley Beale Willie le Roux Christian Wade and Danny Cipriani capable of electrifying a game at any moment.  This is something the coach hopes to keep alive.  They don't have room for injury leading up to the playoffs."""
"""So an individual...who worked with a Russian entity a decade ago is subject to rampant media speculation all day long, even though the Clintons had more extensive ties,"" Spicer said, as he attempted to characterize a double standard."
"It was the first photo Bush, 45, had shared on Instagram in three weeks."
At a Trump rally the industry leaders Comcast to Verizon and to AT&T announced that they would ban together to permanently shut down the internet for Trump supports. Silicon Valley has declared that the wave of Trump supports should create their own internet and build a wall around that. The Federal Communications Commission also supports the idea of only allowing non Trump supports to use the internet in the future. The rules have been up for grabs and the leaders are making claims that make sense to most people and hav e a majority of support from the public. The bias in the country needs to be confronted and it is starting in Silicon Valley California.
"High school students spend years being taught that being fair and honest will always help you get ahead, but with the election of Donald J Trump to the presidency students are now questioning their educational foundations. According to a new national survey conducted by Harris Poll for the JED Foundation, Partnership for Drug-free Kids, and The Jordan Porco Foundation, found that 70 percent of freshmen said they had wished ""Hillary Clinton had won the presidency""."
Do you think it’s a good idea for Kim to become more vocal about her political views?
But other insiders are reporting that they're hoping that Jennifer will finally return from a trip to Tijuana with a baby of her own!
Earlier they endured a nail-biting finish to the Six Nations rugby today when victory was snatched from Wales after twenty minutes of overtime at the Stade de France.
"The environment's best friend has once again kept true to his word and is setting aside more than 12 billion dollars for the preservation of the Rain Forest. Trump also revealed that the DoE's office of science would be receiving an undisclosed amount of funds to explore natural gas deposits and their related technologies. In a tweet today, POTUS wrote ""Gas is beautiful, I love gas. There are great things coming from all kinds of gas . We are going to explore natural gas and benefit bigly.""Scientists around the world applaud president Trump for his effort to keep moving forward in the realms of Science and Technology."
"""I couldn't even control my body,"" said the applicant, a 23-year-old for whom Columbia was the No. 1 choice. ""My teeth even started chattering. I didn't even know that could happen."""
"The ENQUIRER first discovered Jennifer helping out the kids of the Tijuana orphanage back in 2010. ""When you drive up to this place,"" said Jen, ""you see these kids come running out and you hear a chorus of, 'La, la, la, la!'"""
"It’s still a generous likening, especially since Louis has only delivered one track with no announcement of a forthcoming full-length. But that could also be a strategy: where his compadres are actively working the circuit, Tomlinson seems content to drop a banger every so often, leaving fans to thirst after him, instead of vice versa. His longevity, however, will depend on whether he gets behind the production board or begins working the DJ booth. Because as great as Calvin’s Harris’ vocals are, I don’t think any of us need entire albums of them."
The RVT's supporters include TV host Graham Norton and Lord of the Rings star Sir Ian McKellen.
One fan declared she would be 'OK if they dated' while Pakittyy remarked: 'RiRi Royalty!'
"As students headed back to school this year in and around Tampa, Florida, thousands of teacher positions had yet to be filled. It followed a year in which tens of thousands of teachers were hired on emergency or temporary credentials to help fill empty slots around the country - 900 of them in Oklahoma alone. And in Arizona, which has one of the highest teacher turnover rates in the country, school districts routinely report having unfilled teaching positions three months into the school year."
"YouTube has used speech-to-text software to automatically caption speech in videos since 2009 (they are used 15 million times a day). Today it rolled out algorithms that indicate applause, laughter, and music in captions. More sounds could follow, since the underlying software can also identify noises like sighs, barks, and knocks."
"Since Trump took office in January, Graff has become a conduit for those who want to quietly offer advice, make personnel suggestions or get on the president's calendar when he's at his Mar-a-Lago resort in Florida. The list includes investor Ken Langone and Hank Greenberg, the chairman & CEO of CV Starr whose assistant recently went to Graff about trying to set up a lunch with Trump, according to a person with knowledge of the call."
A rep for Kardashian and attorney for Simpson have not yet returned the Daily News' requests for comment.
"Davis features prominently in Bush's Instagram, most recently visiting him in New York with their daughters just before the hot mic scandal."
"Sienna Miller has high praise for the director and script writer of her new film - Lost City of Z. She plays the role of loyal and supportive wife to Amazon explorer Percy Fawcett (played by Charlie Hunnam), who searches for a mysterious lost city in this adaptation of a true story. Her sense of commonality with the character led her to present the director with a hand copied segment of the script, which the director subsequently framed as a testament to Sienna."
"Col Camus added: 'I didn't expect to live so long, it's a surprise. I'm very glad to see you living and not on pictures as I saw the Queen and Charles. Thank you for listening.'"
"She mocked him. After Mr. Trump said President Vladimir V. Putin of Russia had ""no respect"" for her, Mrs. Clinton slyly posited why Mr. Putin seemingly preferred Mr. Trump: ""He'd rather have a puppet as president of the United States,"" she said."
"The U.S. Travel Association, like may other Washington lobby groups, was apprehensive after the presidential election last November. ""We are encouraged that Mr. Trump's extensive business and hospitality background ... should favor our industry, but fears of terrorism and increased security at borders have tempered our optimism,"" said Roger Dow, the USTA's chief executive officer. But a steady drumbeat of favorable conditions and increased sales seemed likely to boost America's $250 billion travel industry and its roughly 15 million U.S. employees."
"Pals revealed the actor had been devastated over a string of failed romances, including a bitter breakup with actress Kate Hudson."
"The Federal Aviation Administration previously urged travelers not to turn on the phones, pack them in checked luggage or charge them during a flight. The new ban is effective at noon Saturday, Transportation Secretary Anthony Foxx said."
"However not everyone was convinced, with twittyj blasting: 'RiRi & Harry together? No thanks. She's a very talented lady, but not quite princess material. Pop princess, perhaps.'"
"Washington (CNN)Democratic lawmakers ""stand ready"" to work with their Republican counterparts following the failure of GOP efforts to repeal Obamacare, Rep. Keith Ellison said Monday."
"According to a source close to the famous family, Kim would like to hire herself a political publicist and Kanye West has been looking for one."
"While he may have failed (at least for now) on his promise to repeal and replace Obamacare, President Donald Trump reassured the country that the fight wasn't over, a statement echoed by Vice President Mike Pence.  He went on to spell out his next goal - eliminating the federal income tax.  ""Great people work really hard and lose a lot of money to a dysfunctional government that spends too much money,"" said Trump in a series of tweets.  ""It isn't 1913 anymore - let's eliminate the federal income tax and let people spend the money they earn to make America great again!"""
The Corpus Christi Caller-Times (http://bit.ly/2gdcS3V) reports the investment comes in the form of 57 Wi-Fi microscopes purchased by officials at the school for its K-5 student curriculum.
"Climbers who reach the 8,850-metre (29,035-feet) Everest summit must produce photographs showing them at the top as proof of their ascent, as well as a report from their liaison official who stays at base camp."
"Kanye was sedated and is being treated by doctors and mental health professionals. Doctors hoped to release him 2 days ago, but that didn't happen and so far ... no new release date."
"*A contestant on “America’s Got Talent” says her performance at a recent taping was roasted so viciously by new host Tyra Banks that it has caused emotional distress to her young daughter, who was watching from the wings."
A new exhibition explores the history of modern urban graffiti - from its roots in the inner cities of Philadelphia and New York  through to the present day global graffiti movement. Masters of Invention - at the Lettering Arts Centre in Suffolk - looks at the emergence of simple personal tags in the late 1960s  to highly intricate contemporary forms of this urban art. It is curated by Errol Donald - a former graffiti artist whose work below was displayed in the UK's first exhibition dedicated to graffiti  in Bristol  more than 30 years ago.
"""She loved Star Island and many of her neighbors. She really thought she would grow old there. But because of Lisa and her husband, she decided to sell her home."""
"Carrey’s referendum, despite its slightly unbearable pitch, rings somewhat true amid the backdrop of destruction caused by Hurricanes Harvey and Irma. And Charlottesville. And the general mood of melancholy that has settled over the country like a thick fog. It’s hard to see where the art and commercialism and spectacle of N.Y.F.W. fits into all that. Designers themselves have struggled with that question since the 2016 election, as have many creators in other fields. The world looks different now than it did even last February, and it will somersault a thousand more times before the clothing parade gears again up next February. (But, make no mistake, the parade will go on.)"
"It comes in orange, apple, banana and mango varieties, and alerts firms to problems with their cooling processes, allowing them to take action."
The American Health Care Act was pulled from an anticipated vote Friday afternoon after it became apparent the bill did not have enough votes to pass.
"You may remember the classic Vespa car like the one Audrey Hepburn drove around Rome in.  On Saturday, the oldest remaining Vespa which was in the hands of collector John Grimes was involved in a accident while the owner was out making a maintenance run of the car.  Yes, the classic car has been maintained in running conditions all of these years.  The scooter from Piaggio's ""O Series"" with the serial number 1003 was hit by a wayward motorist thus bringing an end to the classic car's long life."
"Kanye and his own musical legacy  ""Sir Paul McCartney's final album of the '80s  Flowers in the Dirt  is regarded as one of his best of the decade. He teamed up with new musicians  new producers and a new songwriting partner in the form of Elvis Costello and it inspired his first world tour in 10 years. Now  as the record is re-released  complete with previously unheard demos  Sir Paul speaks to BBC 6 Music's Matt Everitt about collaborating with Costello  Kanye West and Michael Jackson - but why he'll never work with anyone better than John Lennon. Sir Paul also reveals he's working on a new album with Adele's producer  and what he thinks his musical legacy will be."
"Prince Harry, 32, met Rihanna this week during a visit to Barbados "
US actress Shailene Woodley has reached a plea deal over her involvement in the protest against the Dakota Access oil pipeline. Woodley  star of the Divergent series  was one of 27 people arrested at the site last October. She has now signed a document agreeing to plead guilty to misdemeanour disorderly conduct  which would mean she would avoid jail. The pipeline project has been highly controversial and drawn huge protests. Native Americans say it will desecrate sacred land and damage the environment.
"Under the new ""Hillsborough Law,"" 12 London policemen have already been jailed for what many observers have termed minor inconsistencies or respectful evasions in their testimony at inquests. The new law requires total candor from all police officers at every level, and 8 of the jailed policemen have already been sentenced to two-year sentences for giving what their solicitors term ""kind and tactful"" descriptions in open court, rather than the utter transparency the regulations now require. Labor MP Andy Burnham commented, ""When you're a member of one of these grieving families, sometimes you can't handle the truth."""
"The 5-3 ruling could mean a new sentencing hearing for Bobby James Moore, 57, who was convicted of fatally shooting James McCarble during a 1980 grocery store robbery in Houston."
"Facebook has announced that due to the success of emoji's and how widely recognized they have become, Facebook has opted to take the bold step of deleting all emoji's. Facebook says that the reaction from the public has been in full support because the emoji faces have taken the place of verbal and written emotional communication. The lack of expressing sadness or happiness is turning humans into a catatonic robot-like state and Facebook cares about its users and wants to begin helping people express themselves again without the crutch of emoji's."
Princess Diana was allegedly disguised as a male model and smuggled into the venue in the late 1980s.
"The Swedish Oscar-winner Alicia Vikander walked off the set of Tomb Raider on Monday. She had signed on to take over for Angelina Jolie as the new Lara Croft. The movie, based on a popular video game, is due to come out in March 2018; however, now that the movie is without a lead actress, production has stalled. Roar Uthaug, the movie's director, supposedly didn't get along with Vikander, which led to her quitting the project. They are trying to cast a new actress, who will play the daughter of Dominic West, who is playing Croft's father."
"Colleges and universities are pushing back against President Donald Trump's immigration-limiting executive order, promising to protect students and faculty even as they struggle to fully comprehend what the order means for community members who hail from the seven predominantly Muslim countries to which it specifically applies."
"President Trump's daughter, Ivanka, has moved to Washington following her father's inauguration.  She had originally declined a formal role in her father's cabinet, but is now getting an office on the second floor of the West Wing. Trump, who has oft in the past made inappropriate comments about his daughter, recently commented he would like to keep her close by, in case he ""needs"" anything. Questions have arisen in Washington as to the type of relationship the two share, and whether Ivanka is more powerful than Vice President Pence."
"Friends says Jennifer has high hopes Sandra will be able to help guide Justin, who previously dated stylist Heidi Bivens for 14 years, through any problems he is having. Read more: Jennifer Aniston embarks on pre-wedding diet the 'old-fashioned way'"
"""We are definitely a modern family,"" Jen told Today last summer. ""You don't have a choice,"" she added, admitting that while their new normal might look unusual to some, they're actually ""doing really well."""
"He has carried his musical talents and passion through to his career, releasing five albums and collaborating with other artists, including rapper Kanye West on his 2005 smash hit 'Gold Digger'."
The Duchess asked how she had found readjusting to life after the accident.
"Captain Stephane, from French Special Forces, severely injured during Operation Serval, joined them, along with Mrs Montcorge, 94. She was a lieutenant in the Free French Forces in 1943 in London and was appointed as liaison officer to General Patton commanding the 3rd US Army from June 1944 to the end of the war in 1945."
"Kris Jenner later married decathlete Caitlyn Jenner, then known as Bruce Jenner. (RON GALELLA, LTD./WIREIMAGE)"
"Jane Doe says she and her husband were performing an ode to their daughter, identified as Mary, during a taping on March 19. Once they finished, the woman says that she and her husband were “humiliated” by the judges and the audience, who criticized the song."
"That's according to a new study out Wednesday from the Brookings Institution's Brown Center on Education Policy. Researcher Tom Loveless in 2001 surveyed foreign exchange students, then revisited the questions in 2016. He found that the new crop of students believe more strongly that school here is easier than in their native country - and that students here don't work as hard."
